
=== 2026-08-20T17:43:57+10:00 ===
     0  1  2  3  4  5  6  7  8  9  a  b  c  d  e  f    0123456789abcdef
00: 4e 00 f3 00 49 00 f8 00 90 88 71 48 8c a0 75 30    N.?.I.?.??qH??u0
10: 19 c8 07 d0 18 9c 09 c4 27 10 09 d0 1f 07 0c 5a    ????????'??????Z
20: 27 10 00 64 1f 07 00 9e 00 00 00 00 00 00 00 00    '?.d??.?........
30: 00 00 00 00 00 00 00 00 00 00 00 00 00 00 00 00    ................
40: 00 00 00 00 3f 80 00 00 00 00 00 00 01 00 00 00    ....??......?...
50: 01 00 00 00 01 00 00 00 01 00 00 00 00 00 00 1b    ?...?...?......?
60: 27 4c 7f 1f 0f a8 18 f9 15 13 00 00 00 00 00 00    'L????????......
70: 00 00 00 00 00 00 00 00 ff ff ff ff ff ff ff 01    ...............?
80: 00 00 00 00 00 00 00 00 00 00 00 00 00 00 00 00    ................
90: 00 00 00 00 00 00 00 00 00 00 00 00 00 00 00 00    ................
a0: 00 00 00 00 00 00 00 00 00 00 00 00 00 00 00 00    ................
b0: 00 00 00 00 00 00 00 00 00 00 00 00 00 00 00 00    ................
c0: 00 00 00 00 00 00 00 00 00 00 00 00 00 00 00 00    ................
d0: 00 00 00 00 00 00 00 00 00 00 00 00 00 00 00 00    ................
e0: 00 00 00 00 00 00 00 00 00 00 00 00 00 00 00 00    ................
f0: 00 00 00 00 00 00 00 00 00 00 00 00 00 00 00 00    ................


=== 2026-08-20T18:52:28+10:00 ===
     0  1  2  3  4  5  6  7  8  9  a  b  c  d  e  f    0123456789abcdef
00: 50 00 f6 00 46 00 00 00 8d cc 74 04 87 5a 7a 76    P.?.F...??t??Zzv
10: 17 70 01 f4 14 82 04 e2 31 2d 04 97 1f 07 07 46    ?p??????1-?????F
20: 31 2d 02 86 1f 07 03 ff 00 00 00 00 00 00 00 00    1-?????.........
30: 00 00 00 00 00 00 00 00 00 00 00 00 00 00 00 00    ................
40: 00 00 00 00 3f 80 00 00 00 00 00 00 01 00 00 00    ....??......?...
50: 01 00 00 00 01 00 00 00 01 00 00 00 00 00 00 63    ?...?...?......c
60: 1b 05 7d e8 0b 28 16 20 15 e0 00 00 00 00 00 00    ??}??(? ??......
70: 00 00 00 00 00 00 00 00 ff ff ff 00 00 00 00 00    ................
80: ff ff ff ff ff ff ff ff ff ff ff ff ff ff ff ff    ................
90: ff ff ff ff ff ff ff ff ff ff ff ff ff ff ff ff    ................
a0: ff ff ff ff ff ff ff ff ff ff ff ff ff ff ff ff    ................
b0: ff ff ff ff ff ff ff ff ff ff ff ff ff ff ff ff    ................
c0: ff ff ff ff ff ff ff ff ff ff ff ff ff ff ff ff    ................
d0: ff ff ff ff ff ff ff ff ff ff ff ff ff ff ff ff    ................
e0: ff ff ff ff ff ff ff ff ff ff ff ff ff ff ff ff    ................
f0: ff ff ff ff ff ff ff ff 04 40 01 00 00 00 00 00    ........?@?.....

